{
  "schema": "uads.evidence-record",
  "schemaVersion": "0.3.0",
  "evidenceId": "ev_2a14951f53d6ad90",
  "projectId": "8e4b5bd6a6c41b50",
  "workOrderId": "wo_1a9bd8e2df2692e3",
  "executionRunId": "er_47cc270c0ac2aee5",
  "changeDigest": "844d441f03c19ed34bc658747850d0dc1edbc584c260d58a1fe38e4a46d8934e",
  "gateId": "static",
  "sourceRole": "test-engineer",
  "kind": "command",
  "createdAt": "2026-09-09T15:15:06.929Z",
  "status": "PASS",
  "summary": "static pass",
  "command": "eval:static",
  "exitCode": 0,
  "outputRef": "sidecar://execution-runs/er_47cc270c0ac2aee5/evidence/ev_2a14951f53d6ad90.output.txt",
  "outputDigest": "4fc6853bb8532d5f19ec3d67edd11b54889033f4f9c028cef0a33d50383563cd",
  "fileRef": null,
  "fileDigest": null,
  "source": "executed"
}
